<?xml version="1.0" standalone="no"?>
<!DOCTYPE CDs SYSTEM "rich.dtd">
    <CDs>
        <CD id="001">
        <CDName>UK Top 40 Singles</CDName>
        <tracks>
            <track trackNumber="1">
                <Title>Get Up (Rattle)</Title>
                <Artist>Bingo Players Feat Far East Movement</Artist>
                <Genres>
                    <Genre>&rnb;</Genre>
                </Genres>
                <length>00:02:47</length>
            </track>
            <track trackNumber="2">
                <Title>Radioactive</Title>
                <Artist>Rita Ora</Artist>
                <Genres>
                    <Genre>&e;</Genre>
                </Genres>
                <length>00:04:11</length>
            </track>
            <track trackNumber="3">
                <Title>Gangnam Style</Title>
                <Artist>PSY</Artist>
                <Genres>
                    <Genre>&kp;</Genre>
                </Genres>
                <length>00:03:39</length>
            </track>
        </tracks>
        <trackCR>&copyright;</trackCR>
        </CD>
    </CDs>
